Name,Address,Phone,Website,Source,Status,Notes,LastChecked,Error
The Loaf N' Jug Food Mart,"1132 Ninth St N, Kenora, On P9N 2T5",807-468-4045,,Keep,New,,2026-01-26 18:57:37,
The New Duchesnay Store,"40 Goulais Cres, North Bay, On P1B 8G5",705-475-9877,,Keep,New,,2026-01-26 18:57:37,
Timmin'S Store,"Summer Beaver, Nipigon, On P0T 3B0",807-887-2898,http://bdo.ca/,Keep,New,,2026-01-26 18:57:26,
Tj'S Kwik Stop,"34 Hwy 105, Red Lake, On P0V 2M0",807-727-2752,,Keep,New,,2026-01-26 18:57:37,
Tony'S Variety & Video Espanola,"426 Mead Blvd, Espanola, On P5E 1M1",705-869-1011,,Keep,New,,2026-01-26 18:57:37,
Top Valu Convience Store,"1405 Valley Dr, Kenora, On P9N 2V1",807-548-1352,https://www.parkland.ca/,Keep,New,,2026-01-26 18:57:26,
Trapper Trading Post,"2890 Hwy 11 N, Marten River, Nipissing, On P0H 1T0",705-892-2374,http://www.thebeerstore.ca/,Keep,New,,2026-01-26 18:57:26,
Ty'S Smoke House & Supplies,"3 Village Rd, Blind River, Algoma, On P0R 1B0",705-849-6451,https://www.facebook.com/61571361494775,Keep,New,,2026-01-26 18:57:26,
U Can,"208 Loach'S Rd, Sudbury, On P3E 2P7",705-675-8226,http://ucanuniversal.com/,Keep,New,,2026-01-26 18:57:26,
Utterson General Store & Hwy 141 Cafe,"20 Township Hall Rd, Muskoka, On P0B 1L0",705-385-9497,,Keep,New,,2026-01-26 18:57:37,
Valley Foods,"4591 Oliver Rd, Murillo, Nipigon, On P0T 2G0",807-935-2611,http://www.thebeerstore.ca/,Keep,New,,2026-01-26 18:57:26,
Vet'S Confectionery,"6 Sixth Ave S, Kenora, On P9N 2B5",807-468-6394,,Keep,New,,2026-01-26 18:57:37,
Village General Store & Hotel,"22274 Hwy 17, Algoma, On P0R 1H0",705-843-1100,,Keep,New,,2026-01-26 18:57:37,
Voyageur Bait and Tackle,"Hwy 11B, Atikokan, Nipigon, On P0T 1C0",807-597-1575,,Keep,New,,2026-01-26 18:57:37,
Wabigoon Lake Community Store,"Wabigoon Indian Reserve 27, Dinorwic, ON",807-938-6867,,Keep,New,,2026-01-26 18:57:37,
Wapekeka Community Store,"Big Trout Lake, Manitoulin, On P0P 1B0",807-537-1164,,Keep,New,,2026-01-26 18:57:37,
What A Convienence,"2061 Kanienkehaka Iohatatie, Bala, Mactier, On P0C 1A0",705-762-1923,https://www.wahtaconvenience.com/,Keep,New,,2026-01-26 18:57:26,
Woodcrest Confectionary,"119 Woodcrest Dr, Longlac, Nipigon, On P0T 2A0",807-876-9572,http://www.longlacwoodcrest.com/,Keep,New,,2026-01-26 18:57:26,
Your Dollar Store With More,"1-15 Edward St, Wikwemikong, Manitoulin, On P0P 2J0",705-859-2554,https://www.dollarstore.ca/,Keep,New,,2026-01-26 18:57:26,
Zig'S Place,"Hwy 621, Morson, Rainy River, On P0W 1M0",807-488-9637,,Keep,New,,2026-01-26 18:57:37,
